<?xml version="1.0"?>
<!--
Copyright (c) 2024-2026 Project CHIP Authors

Licensed under the Apache License, Version 2.0 (the "License");
you may not use this file except in compliance with the License.
You may obtain a copy of the License at

    http://www.apache.org/licenses/LICENSE-2.0

Unless required by applicable law or agreed to in writing, software
distributed under the License is distributed on an "AS IS" BASIS,
WITHOUT WARRANTIES OR CONDITIONS OF ANY KIND, either express or implied.
See the License for the specific language governing permissions and
limitations under the License.
-->
<!--
XML generated by Alchemy; DO NOT EDIT.
Source: src/service_device_management/CommissionerControlCluster.adoc
Parameters: zap ignore-errored provisional-policy=loose sdkRoot=./connectedhomeip/ specRoot=./connectedhomeip-spec/ attribute=ambient-context-sensor,ambientsensing,cameras,cameras-image-rotation,groupcast,hrap-pdc,hrap-tbrd,hvac-thermostat-events,hvac-thermostat-suggestions,improved-capabilities-tcr,partitioned-crl,security-sensor-events-tcr,tcr-smokeco-unmounted-state,temperature-alarm,thread-commissioning 
Git: 0.7-recirc-1.7-310-gce68ecc95
Alchemy: v1.7.10
-->
<configurator xmlns:xsi="http://www.w3.org/2001/XMLSchema-instance" xsi:noNamespaceSchemaLocation="../../zcl.xsd">
  <domain name="CHIP"/>
  <bitmap name="SupportedDeviceCategoryBitmap" type="bitmap32">
    <cluster code="0x0751"/>
    <field name="FabricSynchronization" mask="0x1"/>
  </bitmap>

  <cluster>
    <domain>General</domain>
    <name>Commissioner Control</name>
    <code>0x0751</code>
    <define>COMMISSIONER_CONTROL_CLUSTER</define>
    <client init="false" tick="false">true</client>
    <server init="false" tick="false">true</server>
    <description>Supports the ability for clients to request the commissioning of themselves or other nodes onto a fabric which the cluster server can commission onto.</description>
    <!-- cluster revision -->
    <globalAttribute side="either" code="0xFFFD" value="1"/>
    <attribute side="server" code="0x0000" name="SupportedDeviceCategories" define="SUPPORTED_DEVICE_CATEGORIES" type="SupportedDeviceCategoryBitmap" default="0" max="0x00000001">
      <access op="read" privilege="manage"/>
      <mandatoryConform/>
    </attribute>
    <command source="client" code="0x00" name="RequestCommissioningApproval">
      <description>This command is sent by a client to request approval for a future CommissionNode call.</description>
      <arg fieldId="0" name="RequestID" type="int64u"/>
      <arg fieldId="1" name="VendorID" type="vendor_id"/>
      <arg fieldId="2" name="ProductID" type="int16u"/>
      <arg fieldId="3" name="Label" type="char_string" optional="true" length="64"/>
      <access op="invoke" privilege="manage"/>
      <mandatoryConform/>
    </command>

    <command source="client" code="0x01" name="CommissionNode" response="ReverseOpenCommissioningWindow">
      <description>This command is sent by a client to request that the server begins commissioning a previously approved request.</description>
      <arg fieldId="0" name="RequestID" type="int64u"/>
      <arg fieldId="1" name="ResponseTimeoutSeconds" type="int16u" min="30" max="120" default="30"/>
      <access op="invoke" privilege="manage"/>
      <mandatoryConform/>
    </command>

    <command source="server" code="0x02" name="ReverseOpenCommissioningWindow" disableDefaultResponse="true">
      <description>When received within the timeout specified by ResponseTimeoutSeconds in the CommissionNode command, the client SHALL open a commissioning window on a node which matches the VendorID and ProductID provided in the associated RequestCommissioningApproval command.</description>
      <arg fieldId="0" name="CommissioningTimeout" type="int16u"/>
      <arg fieldId="1" name="PAKEPasscodeVerifier" type="octet_string" length="97" minLength="97"/>
      <arg fieldId="2" name="Discriminator" type="int16u" max="4095"/>
      <arg fieldId="3" name="Iterations" type="int32u" min="1000" max="100000"/>
      <arg fieldId="4" name="Salt" type="octet_string" length="32" minLength="16"/>
      <mandatoryConform/>
    </command>

    <event code="0x00" name="CommissioningRequestResult" priority="info" side="server" isFabricSensitive="true">
      <description>This event SHALL be generated by the server following a RequestCommissioningApproval command which the server responded to with SUCCESS.</description>
      <field id="0" name="RequestID" type="int64u"/>
      <field id="1" name="ClientNodeID" type="node_id"/>
      <field id="2" name="StatusCode" type="status"/>
      <access op="read" privilege="manage"/>
      <mandatoryConform/>
    </event>

  </cluster>
</configurator>
